{
  "$schema": "https://json-schema.org/draft/2020-12/schema",
  "$id": "https://extension.js.org/schemas/agent-bridge/ready-contract-2.0.json",
  "title": "Extension.js Dev Session Readiness Contract (ready.json)",
  "description": "The per-session runtime contract written to dist/extension-js/<browser>/ready.json by the dev server (producer: programs/develop/plugin-playwright). Polled by `extension wait` / `extension_wait` and read by every other bridge tool for discovery. NOTE: this is the RUNTIME session contract — distinct from docs/readiness/readiness.schema.json, which is the CI build VERDICT for isextensionready.com. v2 adds the control-channel discovery fields (controlPort/instanceId/logsPath).",
  "type": "object",
  "additionalProperties": false,
  "required": ["schemaVersion", "status", "command", "browser", "runId", "startedAt", "distPath", "manifestPath", "pid", "ts"],
  "properties": {
    "schemaVersion": {
      "const": 2,
      "description": "Bumped from implicit v1 when the control-channel fields were added. Routed through the schema-drift guard."
    },
    "status": {
      "enum": ["starting", "ready", "error"],
      "description": "starting → ready on first successful compile; error on compile/launch failure."
    },
    "command": {"enum": ["dev", "start", "preview"]},
    "browser": {"type": "string", "description": "Resolved browser key, e.g. chrome, edge, firefox, chromium-based."},
    "runId": {"type": "string", "description": "Unique per `extension dev` run. Matches log-event.runId and the control `ready.runId`."},
    "startedAt": {"type": "string", "format": "date-time"},
    "distPath": {"type": "string"},
    "manifestPath": {"type": "string"},
    "port": {
      "type": ["integer", "null"],
      "description": "The rspack dev-server port (HMR /ws). NOT the control channel — see controlPort."
    },
    "pid": {"type": "integer"},
    "ts": {"type": "string", "format": "date-time", "description": "Last write time."},
    "compiledAt": {"type": ["string", "null"], "format": "date-time"},
    "errors": {"type": "array", "items": {"type": "string"}, "default": []},
    "code": {"type": "string", "description": "Present when status=error."},
    "message": {"type": "string", "description": "Present when status=error."},

    "instanceId": {
      "type": "string",
      "description": "v2. Per-session shared secret (baked into the sidecar as __INSTANCE_ID__). Required on every control-WS hello."
    },
    "controlPort": {
      "type": ["integer", "null"],
      "description": "v2. Dedicated control WebSocket port (≠ rspack `port`). null when no control channel (e.g. --no-browser with no sidecar)."
    },
    "controlPath": {
      "type": "string",
      "default": "/extjs-control",
      "description": "v2. Path of the control WS endpoint."
    },
    "logsPath": {
      "type": "string",
      "description": "v2. Explicit relative path to logs.ndjson so file-reading agents don't guess, e.g. dist/extension-js/chrome/logs.ndjson."
    }
  },
  "allOf": [
    {
      "if": {"properties": {"status": {"const": "error"}}, "required": ["status"]},
      "then": {"required": ["code", "message"]}
    }
  ]
}
