{
  "schemaVersion": 2,
  "status": "ready",
  "command": "dev",
  "browser": "chrome",
  "runId": "lz4f-9a2b",
  "startedAt": "2026-05-26T22:14:00.000Z",
  "distPath": "/Users/dev/my-ext/dist/chrome",
  "manifestPath": "/Users/dev/my-ext/dist/chrome/manifest.json",
  "port": 8080,
  "pid": 48211,
  "ts": "2026-05-26T22:14:03.512Z",
  "compiledAt": "2026-05-26T22:14:03.500Z",
  "errors": [],
  "instanceId": "lz4f-9a2b",
  "controlPort": 8147,
  "controlPath": "/extjs-control",
  "logsPath": "dist/extension-js/chrome/logs.ndjson"
}
